Date,Screen Name,Full Name,Tweet Text,Tweet ID,Link(s),Media,Location,Retweets,Favorites,App,Followers,Follows,Listed,Verfied,User Since,Location,Bio,Website,Timezone,Profile Image
1/17/2019,@FAOUganda,FAO in Uganda,Country Representative @FAOUganda- @queridoAntonioL and local government officials from West Nile region discuss opportunities for collaboration and @FAO support to improving livelihoods of refugees and host communities. #WithRefugees #ZeroHunger,1085822618576408577,,https://pbs.twimg.com/media/DxGdllFXQAArrQx.jpg,,5,9,Twitter Web Client,3578,1492,53,,11/6/2013,FAO IN Uganda,News and latest information from the Food and Agriculture Organization of the United Nations @FAO in Uganda,http://www.fao.org,,View
1/17/2019,@FAOemergencies,FAO in Emergencies,.@FAO support countries & partners to prepare for &amp; respond to food and agricultural threats and emergencies 👉  #InvestinHumanity #ZeroHunger,1085810957488660481,http://www.fao.org/emergencies/about/en/,https://pbs.twimg.com/media/DxCzBm8X4AI0_UL.jpg,,0,0,TweetDeck,32064,1952,842,✅,6/16/2009,"Rome, Lazio","Official Twitter page for @FAO in emergencies. When we #InvestInHumanity, we can achieve #ZeroHunger. Saving livelihoods saves lives.",http://www.fao.org/emergencies,,View
1/17/2019,@TanzeelSHK,Tanzeel Shaikh,#ZeroHunger #FreeMeal,1085810846549319680,,https://pbs.twimg.com/media/DxCVegUW0AAUIx4.jpg,,0,0,IFTTT,23000,592,86,,6/10/2012,"أبوظبي, الامارات العربية المتح","Testing & Maintenance Engineer - Substation & Overhead (132kV, 33kV, 11kV) ☞ MEP Consultant ☞ Anti Racism RT❌⚌Endorsement",,,View
1/17/2019,@TanzeelSHK,Tanzeel Shaikh,"""Every act of kindness is sadaqa."" #ZeroHunger #FreeMeal",1085810845039370240,,https://pbs.twimg.com/media/DxCUYmpWwAIivGZ.jpg,,0,0,IFTTT,23000,592,86,,6/10/2012,"أبوظبي, الامارات العربية المتح","Testing & Maintenance Engineer - Substation & Overhead (132kV, 33kV, 11kV) ☞ MEP Consultant ☞ Anti Racism RT❌⚌Endorsement",,,View
1/17/2019,@TanzeelSHK,Tanzeel Shaikh,“No one has ever become poor by giving.” #ZeroHunger #FreeMeal,1085810843239952384,,https://pbs.twimg.com/media/DxCNwV1WoAArceZ.jpg,,0,0,IFTTT,23000,592,86,,6/10/2012,"أبوظبي, الامارات العربية المتح","Testing & Maintenance Engineer - Substation & Overhead (132kV, 33kV, 11kV) ☞ MEP Consultant ☞ Anti Racism RT❌⚌Endorsement",,,View
1/17/2019,@FFarmEstates1,Frank Farm Estates Ltd,"By @FAO 👩‍🌾Family farmers have been innovating for 1000s of years. 2day, investing in them is more crucial than ever. Family farmers produce 80% of the 🌍's food, we can't achieve #ZeroHunger without them. #AgInnovation @FAOUganda @JesaFarmDairy @KwagalaFarm @FFarmEstates1",1085810692064653313,,https://pbs.twimg.com/media/DxGTDhuU8AA9_Um.jpg,,1,3,Twitter for Android,274,185,3,,2/9/2018,"Sembabule, Uganda",Agricultural Entreprise est 1960 #Passionate abt #Farming Large scale commercial Breeders of #Dairy #Beef and #Ankole cattle. Importers of Agro Tech 📞776304000,http://www.frankfarm.co.ug,,View
1/17/2019,@Samsonprolific,Ogbole Samson,WE DO NOT NEED MORE FARMERS The need to encourage more people to pick up agriculture seems to be the goal every every developing nation. Empowering people with hoes and cutlasses will but breed poverty. #TechForFarmers #ThursdayThoughts #UrbanFarming #ZeroHunger #FoodSecurity,1085805580588118016,,https://pbs.twimg.com/media/DxGOWFlXcAAZSHK.jpg,,17,28,Twitter Web Client,3267,740,37,,3/1/2010,Nigeria,food production should not be seasonal because hunger is not seasonal. 07087995725 s.ogbole@psnutrac.com,http://www.psnutrac.com,,View
1/17/2019,@FAO,FAO,The benefits of cash transfers extend beyond the household. They benefit the whole community! Here's why 👇 #ZeroHunger,1085801465854259200,,https://pbs.twimg.com/media/DxGKrbsVAAIrj5G.jpg,,13,39,Buffer,272102,529,4999,✅,1/28/2009,"Rome, Italy","Working for #ZeroHunger, a sustainable 🌍 and a secure #FutureofFood for all. Our actions are our future.",http://fao.org,,View
1/17/2019,@IrriHub,Irri Hub Ke/Afric.,"We’ve heard you loud and clear! #AgribusinessTalk254 #ZeroHunger RT @IrriHub: As part of supporting the youths, what would you love to us to support you with as far as Agribusiness is concerned? Comment & Retweet after voting! #AgribusinessTalk254 #KOT #ZeroHunger",1085800809755860992,https://twitter.com/irrihub/status/1085018137374978048,,,2,2,Twitter for iPhone,2516,1915,3,,11/4/2017,Kenya,"Drip irrigation services, Sprinklers, Drip buttons emitters, Agronomical Support",https://m.facebook.com/#!/agrihubke/?ref=bookmarks,,View
1/17/2019,@FAOUganda,FAO in Uganda,#WithRefugees #ZeroHunger RT @kec2150: @FAOUganda promotes social integration and builds the capacity of refugees and host community members to support sustainable and resilient vegetable production in partnership with @ceforduganda thanks to the generous support of the @GovJap. #WithRefugees #ZeroHunger,1085797956173922304,https://twitter.com/kec2150/status/1085630269346975750,https://pbs.twimg.com/media/DxDu9OdWkAAEv85.jpg,,0,5,Twitter Web Client,3578,1492,53,,11/6/2013,FAO IN Uganda,News and latest information from the Food and Agriculture Organization of the United Nations @FAO in Uganda,http://www.fao.org,,View
1/17/2019,@FAOKnowledge,FAO Knowledge,.@FAO and the Government of Switzerland🇨🇭 have opened the call for nominations for the 1st International #Innovation Award for Sustainable Food and Agriculture. Submit your application here 👉  #AgInnovation #ZeroHunger #FutureofFood,1085796120759058432,http://bit.ly/2VRSKZj,https://pbs.twimg.com/media/DxGF0UsXQAA-9pv.jpg,,56,75,Buffer,125347,20566,1825,✅,1/3/2012,"Rome, Italy",Stay in touch for latest materials from Food & Agriculture Organization of United Nations (@FAO). Working for a #ZeroHunger 🌍.,http://bit.ly/FAOoftheUN,,View
1/17/2019,@vivekkkaushik,Vivek Kaushik,#Nutrition4AllwithHungryFoal  #Nutrition #Startup #India #socent #fitness #SDGs #Zerohunger #micronutrients #globalnutrition #InvestinNutrition #WFP #StartupIndia #proteinbars @GAINalliance @startupindia @MinistryWCD @NITIAayog @UNICEF @WHO @1000Days,1085793888743284736,https://amzn.to/2MVZ50g,https://pbs.twimg.com/media/DxGDx9HXgAAXHBT.jpg,,1,0,Twitter for iPhone,158,104,107,,8/5/2013,"New Delhi, India","Entrepreneur, Co-Founder @Hungryfoal, #Socent, #impinv, Sketch Artist, Painter, Photographer, Farmer, Harmonica Player",http://in.linkedin.com/in/vivekkkaushik/,,View
1/17/2019,@HungryFoal,Hungry Foal,#Nutrition4AllwithHungryFoal  #Nutrition #Startup #India #socent #fitness #SDGs #Zerohunger #micronutrients #globalnutrition #InvestinNutrition #WFP #StartupIndia #proteinbars @GAINalliance @startupindia @MinistryWCD @NITIAayog @UNICEF @WHO @1000Days,1085793836885045248,https://amzn.to/2MVZ50g,https://pbs.twimg.com/media/DxGDuIDWwAAW4LQ.jpg,,1,1,Twitter for iPhone,64,217,11,,1/22/2016,"Gurgaon, India","Making nutrition tasty, affordable, appealing and accessible to all ! #Nutrition4AllwithHungryFoal",http://www.hungryfoal.com,,View
1/17/2019,@IamtheHuyana,H.R. هويان رحيلة 呼延,"#ZeroHunger RT @FAO: Why opting for the not so perfect fruit and vegetables is helping the economy, the environment and our mission for #ZeroHunger 🌍 👉  #foodwaste 🍓🍏🍊",1085792490429530112,"https://twitter.com/fao/status/1085738737902923776
http://bit.ly/2JQb3aG",https://pbs.twimg.com/media/DxFRoMPWwAA6Mqa.jpg,,0,0,Twitter for iPhone,25,158,0,,6/24/2016,Taiwan,womxn. clementine-addict. adventurous postcard writer. gregarious traveler.,,,View
1/17/2019,@Food_Safety2018,Food Safety 2019 Congress,#foodwaste is a huge issue for our #global footprint #foodsafety labels can help save our money & reduce #foodwaste Learn more:  #ZeroHunger #foodsecurity @FAO @FDAfood @FDINUK @FDFScotland @FSAIinfo @FSScot @fssaiindia @SciFoodHealth @CDCgov @alliedmeet,1085786957932707841,http://goo.gl/VT7AXV,https://pbs.twimg.com/media/DxF9d9jV4AAILHf.png,,1,2,Twitter Web Client,330,1467,1,,4/18/2018,London,#FoodSafetyCongress presents the 2nd International Conference on #FoodSafety and #Hygiene at London on March 2019 foodsafety@nutritionconferences.com,http://foodsafety-hygiene.alliedacademies.com/,,View
1/17/2019,@theGEF,GEF,"Farmers, fisheries, forestry and value chains utilize natural resources to provide food and fiber for our daily lives. Together, @theGEF and @FAO address the nexus of #agriculture and the #environment  #ZeroHunger",1085778781674094593,http://wrld.bg/zqVX30mfleP,https://pbs.twimg.com/media/DxF2DA9UcAA4NqK.jpg,,5,14,Hootsuite Inc.,41415,1141,951,,5/10/2009,"Washington DC, USA",Official account of the Global Environment Facility. Follow our CEO @NaokoIshiiGEF and Head of Communications @RobbieBisset for live coverage of key events.,http://www.thegef.org,,View
1/17/2019,@UNICManama,UNIC Manama,"With more than 820 million people hungry worldwide, our @WFP colleagues are using innovative approaches to reach those in need:  #ZeroHunger",1085773299823435776,https://bit.ly/2M46go1,,,0,0,Twitter Web Client,6437,134,134,✅,1/5/2010,Kingdom of Bahrain,مركز الأمم المتحدة للإعلام لبلدان الخليج أنشئ في البحرين عام 1977 ويخدم حاليا مملكة البحرين ودولتي قطر والإمارات العربية المتحدة.,http://manama.sites.unicnetwork.org/,,View
1/17/2019,@ICRISAT_LIBRARY,ICRISATLibrary,Agricultural investments and hunger in #Africa modeling potential contributions to #SDG2 – #ZeroHunger #agriculturalinvestments ##agriculturalinvestment #hunger #modeling  @ICRISAT @CGIAR @CGIARnutrition @RPGeneticGains @ICRISAT_HOPE @ICRISATESA @IcrisatW,1085766889391874049,https://www.sciencedirect.com/science/article/pii/S0305750X18304340?via%3Dihub,,,0,5,Twitter Web Client,109,132,3,,10/13/2017,"Hyderabad, India",JSK Library @ ICRISAT provides continuous research assistance to scientific and research community of ICRISAT. A one stop source for agricultural information.,http://www.icrisat.org/,,View
1/16/2019,@TrendUganda,Trend 🇺🇬 Uganda 🇺🇬,"The World’s Most Popular Coffee Species Are Going Extinct, Study Says There is need to embark on preservation. #COP25 #SDGS #EXTINCTION #COFFEE #Conservation #farming #SDG1 #SDG2 #endpoverty #Zerohunger #agriculture #Economy",1085763200027627521,http://flip.it/dfrSmb,,,1,5,Twitter for Android,3,50,0,,1/11/2019,"Kampala, Uganda",Would love to live In a world full of life.,,,View
1/16/2019,@JakobKern1961,Jakob Kern,"Listen to @WFP Deputy CIO Dominik Heinrich talking about #partnership and #innovation. Humanitarian and IT experts coming together to contribute to #ZeroHunger RT @WFP_Europe: Partnerships forge innovation. And innovation forges transformation. To save lives and change lives, we must transform humanitarian assistance. The #HumanitarianHackathon has been a fantastic example of partnership with @BelgiumMFA, @WFP, and @HackBelgiumLabs 🇧🇪🤝🍚",1085757149752541184,https://twitter.com/wfp_europe/status/1085563193668354049,pic.twitter.com/bKeaEtWOJw,,0,12,Twitter for iPhone,3088,40,50,,5/5/2011,"Rome, Italy","@WFP Director of Supply Chain Operations @WFPLogistics. (Tweets reflect my personal views, RT do not imply endorsements)",http://www.wfp.org,,View
1/16/2019,@FAotC,Lynne Strong,Wow interesting article this would be a radical change in diet for me “How to feed a growing population healthy food without ruining the planet” #ZeroHunger #zerowaste,1085756289437691905,http://theconversation.com/how-to-feed-a-growing-population-healthy-food-without-ruining-the-planet-108994,,,0,1,Twitter for iPhone,4666,3325,148,,11/12/2011,Jamberoo,Winner Bob Hawke Medal. Founder Picture You in Agriculture @art4ag @archibull Farmers & community working together to power the future,http://www.pictureyouinagriculture.com.au,,View
1/16/2019,@FarmTradeIndia,Farm Trade India - FTI,Willing to achieve #ZeroHunger through Zero #foodwaste  #FarmTradeIndia #ZeroHunger #zerowarehousing #farmers #fticonnect #fruits #vegetables #,1085739473995001856,"http://bit.ly/2QFTgKZ
http://bit.ly/2APer30",https://pbs.twimg.com/media/DxFSTDXWsAE40FH.jpg,,0,1,IFTTT,33,145,0,,8/1/2018,,Agricultural Services | #Agricultural produce #marketing and #distribution services. RTs are not endorsements.,http://www.farmtradeindia.co.in,,View
1/16/2019,@FAO,FAO,"Why opting for the not so perfect fruit and vegetables is helping the economy, the environment and our mission for #ZeroHunger 🌍 👉  #foodwaste 🍓🍏🍊",1085738737902923776,http://bit.ly/2JQb3aG,https://pbs.twimg.com/media/DxFRoMPWwAA6Mqa.jpg,,28,62,Buffer,272102,529,4999,✅,1/28/2009,"Rome, Italy","Working for #ZeroHunger, a sustainable 🌍 and a secure #FutureofFood for all. Our actions are our future.",http://fao.org,,View
1/16/2019,@allequality2017,allequality2017,"Hon’ble ALL,#EQUALITY ENABLES TO FOLLOW #PEACE.#GDPS;#JOBS MAY GROW(10-400%)BY SCIENTIFICALLY FARMING ½YEARLY LEFTOVER CULTIVABLE EMPTY LANDS(15-50%)IN THE GLOBE #DEMOCRATICALLY.THIS MAY MEET #JOBS;#ZeroHunger FOR ALL👫.Inconvenience caused is deeply regretted.#SecureALL&FARMERS",1085736515420864512,,https://pbs.twimg.com/media/DxFPcEvUUAE6XFz.jpg,,0,0,Twitter for Android,105,4992,0,,2/4/2017,#PEACE#LOVE#HUMANITY#EQUALITY,"Hon’ble All,EQUALITY ENABLES TO FOLLOW PEACE,LOVE,UNITY, COMPASSION,HUMANITY & SOUL. Inconvenience caused is deeply regretted.BRgds📧allequality2019@yahoo.com",,,View
1/16/2019,@victor_mbao,Victor Mbao,"Talk about #Innovations in food security and reducing #foodwaste, here is one. Kudos to @IITA_CGIAR. #ZeroHunger #animalhealth RT @Livestock_CGIAR: Not only that, #DYK cassava peels can also be ground down to become chicken feed? #Sustainable #Economical @ILRI",1085735262922203136,"https://twitter.com/Livestock_CGIAR/status/1085659033850105856
http://bit.ly/2AOFLhT
https://twitter.com/rodger_voorhies/status/1085573392181256192",,,0,0,Twitter for Android,197,151,8,,7/20/2011,"Nairobi, Kenya",Animal health scientist advocating for innovation in #livestock #vaccines. Passion for #OneHealth and #foodsecurity. @Livestock_IDRC @IDRC_CRDI @IDRC_AFRIQUE,http://www.idrc.ca,,View
1/16/2019,@rha_india,Robin Hood Army,"Our family got stronger, now serving smiles in Botswana 💚 Join us  #RHA #Botswana #ZeroHunger",1085735124975697924,http://www.robinhoodarmy.com/join/,https://pbs.twimg.com/media/DxFOSDTXgAAwTwb.jpg,,12,67,Twitter for Android,8110,519,53,,12/20/2014,,Official Twitter handle of The Robin Hood Army in India. We work to get surplus food from restaurants to the less fortunate. IG: rha_india,http://www.robinhoodarmy.com,,View
1/16/2019,@AssociationAwak,AWAK - Association of Women in Agriculture Kenya,Our Thursday training sessions begin in earnest; Building capacities of small scale Women farmers for #FoodSecurity #ZeroHunger #FutureofFood #climatechange #innovation #KenyaUnbowed,1085732129139494913,,,,0,0,Twitter for Android,359,1120,6,,3/6/2018,Kenya,"Building the capacity of small scale women and young farmers in Kenya, to become informed decision makers and key industry players.",,,View
1/16/2019,@FarmTradeIndia,Farm Trade India - FTI,Willing to achieve #ZeroHunger through Zero #foodwaste  #farmtradeindia #zerowarehousing #fticonnect #fruits #VEGETABLES #Farmers RT @FAO: They may be different shapes and sizes but a carrot is a carrot. Don't judge. Pick 'ugly' fruit and vegetables to reduce your #foodwaste. Every action counts for a #ZeroHunger world.,1085728171725590530,"http://www.farmtradeindia.co.in
https://twitter.com/FAO/status/1084692118973677569",pic.twitter.com/KXX44i1Fzm,,0,1,Twitter for Android,33,145,0,,8/1/2018,,Agricultural Services | #Agricultural produce #marketing and #distribution services. RTs are not endorsements.,http://www.farmtradeindia.co.in,,View
1/16/2019,@maxfinberg,Max Finberg,"Excited for this bipartisan leadership for #ZeroHunger RT @WFPUSA_CEO: Congrats to newly appointed House Ag Approps Ranking Member @JeffFortenberry and Chair @SanfordBishop as well as State, Foreign Ops Subcmt Chair @NitaLowey and Ranking Member @RepHalRogers. We look forward to continuing our work with you to end hunger around the world #ZeroHunger",1085697227371237376,"https://twitter.com/wfpusa_ceo/status/1085662570357260288
https://twitter.com/AppropsDems/status/1085606062986797059",,,0,1,Twitter for iPhone,874,289,47,,1/5/2016,"Maryland, USA","Husband, father, son, brother. Seeker and Sojourner. Join me in alleviating poverty. Tweets are my own.",http://growinghopeglobally.org,,View
1/16/2019,@LakshVVN,Dr. Lakshmi A. Dave,Looking forward to the @EATforum-@TheLancet report on #Sustainable #Diets. Keen to understand what transformations have been proposed to our current food systems/dietary patterns that could help secure 10 billion of us by 2050. #ZeroHunger #SDG #climatechange #NutritionSecurity RT @TheLancet: TONIGHT at 2330 h GMT we publish the @EATforum–@TheLancet Commission on healthy diets from sustainable food systems. Follow #EATLancet #foodcanfixit Watch the livestream of the launch event in @UniOslo tomorrow 14:30–16:00 CET,1085669296485724160,"https://twitter.com/TheLancet/status/1085522166844702720
https://eatforum.org/eat-lancet-commission/",https://pbs.twimg.com/media/DxCGpnFWoAASoih.jpg,,0,4,Twitter Web Client,82,584,1,,7/30/2011,Palmerston North,"Human nutrition researcher at Massey University, solving the convoluted puzzle of Nutrition Adequacy for All; lover of garba & petrichor, dreamer. Tweets my own",https://www.researchgate.net/profile/Lakshmi_Dave,,View
1/16/2019,@AzeezSalawu,Azeez SALAWU - #SDGs🇳🇬,"It is going to be an interesting moment when the farmers and political candidates meet to discuss the various agricultural issues in Nasarawa. Join in the conversation via facebook, instagram and twitter by 1pm tomorrow. #MeetTheFarmers #United4Food #2019Election #ZeroHunger",1085665001355051008,,https://pbs.twimg.com/media/DxEOjh9XQAES2rd.jpg,,4,9,Twitter for iPhone,714,1958,11,,7/26/2012,"Abuja, Nigeria",Making impact @cafsng @hedang Food Security||Climate Change||Public Policy||Agribusiness||SDGs Advocate #IITA #FUNAAB #AIESEC #CAFS #YALI,https://www.linkedin.com/in/azeez-a-salawu-18b092104,,View
1/16/2019,@KatiesKrops,KatiesKrops,"“If you want to touch the past, touch a rock. If you want to touch the present, touch a flower. If you want to touch the future, touch a life.” Our first harvest of 2019. We look forward to touching many lives in 2019. #GivingBack #ZeroHunger #SharingOurHarvest",1085663720661954560,,https://pbs.twimg.com/media/DxEKXE6VYAEJQ0V.jpg,,4,14,Twitter Web Client,1920,768,64,,5/17/2011,,The mission of Katie's Krops is to empower youth to start & maintain vegetable gardens of all sizes & donate the harvest to help feed people in need.,http://www.katieskrops.com,,View
1/16/2019,@WFPUSA_CEO,Rick Leach,"Congrats to newly appointed House Ag Approps Ranking Member @JeffFortenberry and Chair @SanfordBishop as well as State, Foreign Ops Subcmt Chair @NitaLowey and Ranking Member @RepHalRogers. We look forward to continuing our work with you to end hunger around the world #ZeroHunger RT @AppropsDems: The @AppropsDems are proud to announce the nominations for Subcommittee Chairmanships and Vice Chair of the House Appropriations Committee for the 116th Congress. Read @NitaLowey’s full statement →",1085662570357260288,"https://twitter.com/AppropsDems/status/1085606062986797059
https://appropriations.house.gov/news/press-releases/lowey-announces-appropriations-committee-roster",https://pbs.twimg.com/media/DxDYK8KW0AAZpaX.jpg,,0,6,Twitter Web Client,105,227,5,,8/29/2018,"Washington, DC","The official Twitter account of President and CEO for @WFPUSA, Rick Leach.",http://wfpusa.org,,View
1/16/2019,@FAO,FAO,What we eat starts with the seeds we plant 🌱 and the #foodsystems we have in place. #ZeroHunger,1085662336625577985,,https://pbs.twimg.com/media/DxEMJEtWoAEoDr2.jpg,,64,140,Buffer,272102,529,4999,✅,1/28/2009,"Rome, Italy","Working for #ZeroHunger, a sustainable 🌍 and a secure #FutureofFood for all. Our actions are our future.",http://fao.org,,View
1/16/2019,@AgriFoodNet,Agri Food Net,Don't think #infrastructure and #hunger are related? Think again! @IISD_news has created an excellent report on Financing Rural Infrastructure: Priorities and Pathways for Ending Hunger. Take a read here:  @UN_CFS #SDG2 #zerohunger,1085661907082792961,https://bit.ly/2FBjszs,,,7,10,Hootsuite Inc.,5136,5031,213,,7/16/2013,"Rome, Lazio",IAFN is the elected focal point of the Private Sector Mechanism (PSM) at the UN Committee on World Food Security (CFS). Managed by Emerging Ag. #B4FoodSecurity,http://www.agrifood.net/,,View
1/16/2019,@fare_int,FARE International,This week our team is back in Ghana measuring and providing nutrition supplements to children under 2 years old. We love the babies! 🇬🇭 #zerohunger #forthebabies @ Ghana — in Ghana,1085649486481739776,https://www.facebook.com/1577912185783952/posts/2107589946149504/,,,0,0,Facebook,2,0,0,,1/5/2016,"Cleveland, GA 30528, United St",Providing Food Security and treating Acute Malnutrition through Research and Education,http://fareinternational.org,,View
1/16/2019,@sangram_rane,Sangram Rane,"Imperative to accelerate action towards achieving #ZeroHunger! Specifically with approaches that bring together #climatechange + #foodsecurity/#malnutrition + #Health & have scientific targets #ZeroHunger @davidnabarro @TheLancet @EATforum @SUN_Movement @GerdaVerburg @G_stordalen RT @davidnabarro: Very excited for this week’s global launch of the #EATlancet Commission on food, planet &amp; health. Follow everything live online or attend one of the 30+ launches worldwide:  #foodcanfixit #ZeroHunger @TheLancet @EATforum",1085624400689487874,"https://twitter.com/davidnabarro/status/1085187164881604608
http://www.eatforum.org",https://pbs.twimg.com/media/Dw9b0vzU8AE9wDY.png,,2,6,Twitter Web Client,64,121,5,,6/8/2009,"New York, NY",Innovation & Sustainable Development @ United Nations,,,View
1/16/2019,@fison_ng,Fisheries Society of Nigeria,#DYK #fish provides more than 3.2 billion people with almost 20% of their average per capita intake of animal @FAOfish #protein? #Nutrition #Fisheries #ZeroHunger,1085614443172642818,,https://pbs.twimg.com/media/DxDgjnqWwAIH2_a.jpg,,0,0,Twitter for Android,15,29,0,,12/24/2018,Nigeria,"The Fisheries Society of Nigeria, inaugurated in 1976, is Nigeria's Non- Governmental Apex Organization of all fisheries practitioners in Nigeria.",http://fison.org.ng,,View
1/16/2019,@FAO,FAO,#NowReading | Germany targets #foodwaste with supermarket scanner that determines the freshness of food. 👉 via @FoodNavigator #ZeroHunger,1085613665863249922,http://bit.ly/2FC3h55,https://pbs.twimg.com/media/DxDf3_oW0AA6ooT.jpg,,10,31,Buffer,272102,529,4999,✅,1/28/2009,"Rome, Italy","Working for #ZeroHunger, a sustainable 🌍 and a secure #FutureofFood for all. Our actions are our future.",http://fao.org,,View
1/16/2019,@FAO,FAO,Bees and other pollinators are threatened with extinction. Yet they are vital to life on our 🌎. We can all play our part to #Savethebees! Here's how 👉 #pollinators #ZeroHunger,1085611149725519873,http://bit.ly/2VVs75I,https://pbs.twimg.com/media/DxDdlk4W0AAnHzW.jpg,,100,168,Buffer,272102,529,4999,✅,1/28/2009,"Rome, Italy","Working for #ZeroHunger, a sustainable 🌍 and a secure #FutureofFood for all. Our actions are our future.",http://fao.org,,View
1/16/2019,@mjcnoble,micheal noble,"#UNGA With Goodwill, Aid #displacedpeople by digitized apps #Techfugees #olio_ex #foodbanks #ai #blockchain aiding #wfp #zerohunger #humanrights #jobs #futureofwork #g20 #undp #globalgoals #whitehouse @JoinJara in #elpaso border #bpolitics #whpresscorp Enable Life RT @BetoORourke: At the international boundary of the United States and Mexico. Taken this evening from the Paso del Norte bridge that joins El Paso and Juarez.",1085609158236426240,https://twitter.com/BetoORourke/status/1084315525524672512,pic.twitter.com/GixXxSprnI,,0,0,Twitter Web App,61,447,20,,6/2/2011,Weybridge.,,,,View
1/16/2019,@StampOutHunger,Stamp Out Hunger®,"Thank you to all our partners supporting our 2019 #StampOutHunger Food Drive -- @USPS, National Rural Letter Carriers' Association, @UFCW, @UnitedWay, @AFLCIO, @Valpakcoupons, @valassis, @KelloggsUS The food drive is held on May 11, 2019. Join us! #globalgoals #zerohunger",1085606263235510275,,https://pbs.twimg.com/media/DxDZGgnWwAATPO1.jpg,,8,16,Twitter Web Client,7372,5087,229,,4/17/2009,,"Since 1993, the Letter Carriers’ Stamp Out Hunger® Food Drive has been the U.S.’s largest 1-day drive, held annually on the 2nd Saturday in May. #StampOutHunger",http://www.stampouthungerfooddrive.us/,,View
1/16/2019,@mjcnoble,micheal noble,"#UNGA With Goodwill, Aid #displacedpeople by digitized apps #Techfugees #olio_ex #foodbanks #ai #blockchain aiding #wfp #zerohunger #humanrights #jobs #wef #futureofwork #g20 #undp #globalgoals #imf #ituc #ap @JoinJara #africanunion Enable Life RT @UNHCRgov: UNHCR @RefugeesChief welcomed 🇳🇴Amb @HansBrattskar today. Thank you 🙏🏽 Norway for the continued support, helping UNHCR build brighter futures for refugees.",1085600366094438400,"https://twitter.com/UNHCRgov/status/1085219280013217792
https://twitter.com/NorwayInGeneva/status/1085189878776647681",,,0,0,Twitter Web App,61,447,20,,6/2/2011,Weybridge.,,,,View
