Date,Screen Name,Full Name,Tweet Text,Tweet ID,Link(s),Media,Location,Retweets,Favorites,App,Followers,Follows,Listed,Verfied,User Since,Location,Bio,Website,Timezone,Profile Image
1/11/2019,@FAO,FAO,1.3 BILLION tonnes of food is wasted every year. We can: 🛒Shop smart 📅Understand dates on food 🍏Buy 'ugly' fruit and vegetables What are your tips to reduce #foodwaste? #ZeroHunger,1083777319095992320,,https://pbs.twimg.com/media/DwpZumsWwAARL6i.jpg,,167,307,Buffer,272102,529,4999,✅,1/28/2009,"Rome, Italy","Working for #ZeroHunger, a sustainable 🌍 and a secure #FutureofFood for all. Our actions are our future.",http://fao.org,,View
1/11/2019,@FrontierEvan,Evan Preston,"Unacceptable. We know we’ve got the food, got the means to solve the problem. Thanks to @saragoldrickrab and the folks at @BHCCBoston taking action for #ZeroHunger RT @HousingFamilies: 1 In 10 College Students In Mass. Are Homeless. More Are Hungry. It's Past Time We Recognize Their Reality  via @cogwbur",1083772104246546432,"https://twitter.com/HousingFamilies/status/1083357994107179008
https://wbur.fm/2IsUv84",,,2,8,Twitter for iPhone,600,904,16,,12/19/2011,Olamina’s Acorn,"Senior Director of New Economy Campaigns @uspirg, from the rural Land of Lincoln, “They know that they, like the child, are not free”",https://uspirg.org/feature/usp/new-economy,,View
1/11/2019,@ccefarms,CCE Business Group,"The President of the African Development Bank (AfDB) @akin_adesina Said, “By 2030, the size of the Food and Agric business in Africa will reach $1 Trillion. So, if you are thinking of how to make money, that is the sector to be in. ” #ZeroHunger",1083762802857336832,https://talkglitz.tv/2018-next-generation-billionaires-africa-will-farmers-akinwumi/,https://pbs.twimg.com/media/DwpMhfaX4AATdg2.jpg,,3,2,Twitter for Android,188,405,0,,12/17/2018,Rwanda,We are a Youth Led agribusiness company that is based in Rwanda. Our Vision is to become the leading producer and exporter of Horticultural Products in Rwanda.,https://web.facebook.com/mukesha250/?modal=admin_todo_tour,,View
1/11/2019,@GreenspaceLtd,GREEN SPACE LTD,"اشجار الفاكهة : نحن نرعاها ونعتني بها ،لتنمو بشكل أفضل وطبيعي ، لتصل ثمارها إلى موائدكم نظيفة وصحية وخالية من التلوث. Fruit trees/ Mango We care for them, to grow better and naturally & to bring fruit to your tables clean, healthy and pollution-free. #ZeroHunger #Yemen",1083761415595454464,,pic.twitter.com/rwCUebPinO,,0,0,Twitter for Android,38,47,0,,1/10/2018,Yemen,"We offer a products for many vital sectors,#Agricultural,#Environmental & industrial,based on a numbers of local #natural #resources #Zeolite,#Bentonite...",http://www.greenspace-ltd.com,,View
1/11/2019,@planttreaty,PlantTreaty,"Seeds=Plants=Food, which leads to #nutrition #Food Working towards #ZeroHunger: #DYK that @FAO International @planttreaty has a #BenefitSharingFund that supports #agricultural #development #projects in #DevelopingCountries? Take a peek:  RT @IFAD: It is impossible to eradicate hunger without having access to adequate and affordable nutritious food. #InvestInNutrition #EndPoverty",1083758383541469184,"https://bit.ly/2OqmQST
https://twitter.com/IFAD/status/1083309993393299456",https://pbs.twimg.com/media/Dwiwsk2WkAEmRnE.jpg,,1,4,Twitter Web Client,548,1110,19,,5/31/2009,Rome,"International Treaty on Plant Genetic Resources for Food & Agriculture (PGRFA) of the FAO, the UN agency leading efforts towards #ZeroHunger",http://www.fao.org/plant-treaty,,View
1/11/2019,@thestarboy96,The Star Boy,Simmba Boxoffice collection break Zero's record | Shocking ! Watch here 🤠🤠👇👇👇👇  #SimmbaReview #Simmba #ZeroHunger #zerowaste #BollywoodNews,1083754186792001537,https://www.gigsilver.com/simmba-total-boxoffice-collection-break-all-record-of-shahrukh-khan-zero-ranveer-singh-sara-ali-khan-shock/,https://pbs.twimg.com/media/DwpErl4VYAAsHTN.jpg,,0,0,Twitter Web Client,0,12,0,,1/5/2019,"Kolkata, India",Movie Reviews😇Trailer/song Breakdown 👺👹Gossips - Movie updates 👩‍🦰👲Upcoming new movie-and many more 🦁💕💕,http://www.gigsilver.com,,View
1/11/2019,@stewajo09,Jonathan S. Stewart,#letfeeduscampaign We can feed ourselves and the youth have a major role to play #zerohunger #fao,1083754082844725248,,https://pbs.twimg.com/media/DwpElGSWoAEGR8E.jpg,,2,1,Twitter for Android,21,70,0,,2/1/2017,Liberia,Nonprofits- I am an advocate for youth involvement/employment in agriculture and agribusiness activities through ICT innovation,,,View
1/11/2019,@AgriFoodNet,Agri Food Net,#DYK that Africa loses USD 25 billion per year due to child malnutrition? @AfDB_Group has launched a Multi-Sectoral #Nutrition Action Plan commited to reducing stunting by 40% in African children aged under 5 by 2025. Read more:  #SDG2 #zerohunger,1083751699439861765,https://bit.ly/2SOAIVF,,,3,1,Hootsuite Inc.,5136,5031,213,,7/16/2013,"Rome, Lazio",IAFN is the elected focal point of the Private Sector Mechanism (PSM) at the UN Committee on World Food Security (CFS). Managed by Emerging Ag. #B4FoodSecurity,http://www.agrifood.net/,,View
1/11/2019,@FAO,FAO,Climate change is a GLOBAL issue. It is affecting especially the most vulnerable and could push an additional 122 million people into poverty! We can all take #ClimateAction to avoid this from happening! #ZeroHunger,1083740639697739778,,pic.twitter.com/T2fHLHqZVs,,187,298,Buffer,272102,529,4999,✅,1/28/2009,"Rome, Italy","Working for #ZeroHunger, a sustainable 🌍 and a secure #FutureofFood for all. Our actions are our future.",http://fao.org,,View
1/11/2019,@9MilesProject,9Miles Project,Did you know? We feed our children 5 times per week ...and often it's their only meal of the day! Help us to find our official food partner for 2019... #zerohunger #partnerwithpurpose,1083736402838409218,,https://pbs.twimg.com/media/Dwo0fIBXQAADNzj.jpg,,1,2,Twitter Web App,536,615,8,,4/30/2014,"Cape Town, South Africa",A youth and community development programme which uses surfing as a catalyst to impact and transform at-risk youth in coastal communities #CapeTown #Ebay #JBay,http://9milesproject.org/,,View
1/11/2019,@FAOKnowledge,FAO Knowledge,"By 2025, millions of people are expected to be facing water scarcity challenges. How are you saving #water?  💧 #EveryDropCounts #ZeroHunger",1083733061349662720,http://bit.ly/2CXq8qv,pic.twitter.com/Wc525yJTJt,,52,51,Buffer,125347,20566,1825,✅,1/3/2012,"Rome, Italy",Stay in touch for latest materials from Food & Agriculture Organization of United Nations (@FAO). Working for a #ZeroHunger 🌍.,http://bit.ly/FAOoftheUN,,View
1/11/2019,@JakobKern1961,Jakob Kern,Check out this article on the ⁦@WFP⁩ Website about ⁦@WFPLogistics⁩ contribution to end global hunger #ZeroHunger Against all odds – World Food Programme Insight,1083726239871963138,https://insight.wfp.org/against-all-odds-518c58191b1f,,,4,5,Twitter for iPhone,3088,40,50,,5/5/2011,"Rome, Italy","@WFP Director of Supply Chain Operations @WFPLogistics. (Tweets reflect my personal views, RT do not imply endorsements)",http://www.wfp.org,,View
1/11/2019,@FAO4Members,FAO4Members,🏛️ Eliminating hunger by 2030 will require appropriate legislation backed up by the necessary budgets and proper monitoring. 📙 Here are 10 Contributions parliamentarians can make towards achieving #ZeroHunger:,1083725227236962304,http://bit.ly/2SPsHjE,https://pbs.twimg.com/media/DwoqWdoWkAIR815.jpg,,5,9,Buffer,5332,2403,165,,2/18/2009,"Rome, Italy",Tool for @FAO Members and donors to facilitate & support their participation. RT is not endorsement. Working for #ZeroHunger.,http://bit.ly/FAOMembers,,View
1/11/2019,@WFP_UK,WFP UK,The road to #ZeroHunger is fraught with challenges but nothing not even wooden bridges will stand in our way! @WFP truck navigates its way through a bad stretch of a road in Yambio #SouthSudan 🇸🇸,1083721779242258432,,https://pbs.twimg.com/media/DwoKmZEX4AE4PZT.jpg,,1,2,Twitter Web Client,3504,1079,108,,5/21/2013,"London, United Kingdom",UK account of the United Nations World Food Programme (@WFP) – the world's largest humanitarian agency fighting hunger worldwide.,http://www.wfp.org,,View
1/11/2019,@NKS_Horizon_EU,NKS-Netzwerk zu Horizont 2020,"Der 3. FACCE SURPLUS Aufruf ist geöffnet: über 6 Millionen Euro an Forschungsgeldern, um innovative und nachhaltige Biomasseproduktion zu fördern. @FACCEJPI #Landwirtschaft #FOOD2030EU #ZeroHunger #SDGs",1083715539946688512,http://projects.au.dk/faccesurplus/joint-calls/third-call/,,,0,0,Twitter Web Client,28,44,0,,1/2/2019,"Bonn, Deutschland",Hier twittert die Geschäftsstelle des Netzwerks der Nationalen Kontaktstellen in Deutschland zum EU-Rahmenprogramm für Forschung und Innovation.,https://www.horizont2020.de,,View
1/11/2019,@FAO,FAO,How much do you really know about #migration? Here are 5 things you might not know 👇 #ZeroHunger #ForMigration,1083715047292059648,,pic.twitter.com/TLE3HZdfPY,,97,137,Twitter Web Client,272102,529,4999,✅,1/28/2009,"Rome, Italy","Working for #ZeroHunger, a sustainable 🌍 and a secure #FutureofFood for all. Our actions are our future.",http://fao.org,,View
1/11/2019,@WFP_IT,WFP Italia,"Grazie @cooperazione_it per sostenere i programmi di protezione sociale del @WFP in Somalia. #ZeroHunger significa anche costruire la resilienza per i più vulnerabili. @WFPSomalia RT @cooperazione_it: 🇮🇹DevCoop is building #resilience culture in #Somalia With a new €1.7M to @UNDPSomalia Programme on Youth Employment, we help youth to build #Somalia future Through €2M to @WFPSomalia @unicefsomalia social protection programme, we create a security net for vulnerable people",1083713935373672449,https://twitter.com/cooperazione_it/status/1083669045281546240,https://pbs.twimg.com/media/Dwn2JKRXgAADC_H.jpg,,0,1,Twitter Web Client,4429,1425,157,,5/23/2011,,Account di WFP e WFP Italia Onlus. Il WFP è l'agenzia ONU che combatte la fame nel mondo. WFP Italia è la ONLUS a sostegno del WFP.,http://wfp.org/it,,View
1/11/2019,@AS_and_SL,AS&SL,#AS_&_SL #AS&amp;SL #Hydroponic #Hydroponics #CodexAlimentarius #ClimateChange #FoodSafety #Hydroponicfertilizer #ZeroHunger #HomeGardening #TeachAg #microgreens #GreenHands #homegrown #homegardening #urbangardener #backyardgarden #pottedplants,1083711485161947136,http://www.garden-counselor-lawn-care.com/organic-vs-non-organic-fertilizer.html,,,0,0,Twitter Web Client,45,427,0,,6/1/2018,"Nairobi, Kenya",Antace Sourcing & Supplies Co. Ltd,http://antacesourcing.com/,,View
1/11/2019,@IsDBEngage,IsDB Engage,"#SDG2 focuses on meeting the nutritional needs of adolescent girls, pregnant women and the elderly in developing countries, with the aim to end hunger and malnutrition by 2030:  #ZeroHunger",1083710418818945024,http://ow.ly/BhUG30nex0l,https://pbs.twimg.com/media/Dwoc4faX0AAN5mh.jpg,,3,2,Hootsuite Inc.,3058,290,14,,10/26/2017,Jeddah,"Engage is a digital hub which will accelerate economic and social progress in the developing world through the power of science, technology and innovation.",https://www.isdb-engage.org,,View
1/11/2019,@FAOKnowledge,FAO Knowledge,Agriculture is the backbone of rural job creation in #Senegal. Check out how a new project is providing resources to farmers to strengthen #foodsecurity:  #ZeroHunger,1083709997664690176,http://bit.ly/2Rl9aL2,https://pbs.twimg.com/media/DwoZqDeXQAAVvzV.jpg,,9,24,Twitter Web Client,125347,20566,1825,✅,1/3/2012,"Rome, Italy",Stay in touch for latest materials from Food & Agriculture Organization of United Nations (@FAO). Working for a #ZeroHunger 🌍.,http://bit.ly/FAOoftheUN,,View
1/11/2019,@foodclique,foodclique,"""Let us always meet each other with smile, for the smile is the beginning of love."" ~ Mother Teresa #feedthehungry #zerohunger #freeschoolmeals #fightinghungertogether",1083709091342622720,,https://pbs.twimg.com/media/DwobqCTXQAEpgpn.jpg,,3,5,Twitter for Android,883,322,15,,10/19/2011,Nigeria,"We are a Charity NGO that provide free food to children,women,seniors,disable,homeless,unemployed,working poor&other agencies that struggle for FOOD to live",http://www.foodclique.org,,View
1/11/2019,@AS_and_SL,AS&SL,#AS_&_SL #TheBigStory #AS&amp;SL #Hydroponic #Hydroponics #CodexAlimentarius #ClimateChange #FoodSafety #FoodTrade #Hydroponicfertilizer #ZeroHunger #hydroponics #microgreens #GreenHands #homegrown #homegardening #urbangardener #backyardgarden #pottedplants,1083706649867706368,https://extension.oregonstate.edu/news/heres-scoop-chemical-organic-fertilizers,,,0,0,Twitter Web Client,45,427,0,,6/1/2018,"Nairobi, Kenya",Antace Sourcing & Supplies Co. Ltd,http://antacesourcing.com/,,View
1/11/2019,@sarahmartinPR,Sarah Martin,"Congrats to @firstfortnight event last night @Mendicity1818 on a fantastic event nourishing for mind, body and soul #FFfest19 #mentalhealth #ZeroHunger",1083692027856924672,,https://pbs.twimg.com/media/DwoMF_vWsAAuMPm.jpg,,0,3,Twitter for iPhone,1013,1131,25,,11/18/2011,Dublin via Galway,"Director of Comms @Concern Agenda 2030, feminist, mental health advocate, novice runner, mother. Ex @RTE @PresidentIrl . Views my own. Pic @jasonpkennedy",http://www.concern.net,,View
1/11/2019,@APADECO_BURUNDI,APADECO Burundi,"#Burundi Dans notre lutte contre la famine et la malnutrition, nous avons lancé tout au début de l'année 2019 un projet de culture des légumineuses ""Rengarenga"" en @MairieBujumbura #Zerohunger @BimenyimanaFab @DRurema",1083690531123810304,,https://pbs.twimg.com/media/DwoKq3PX0AARRkX.jpg,,6,10,Twitter for Android,618,230,1,,12/10/2016,Burundi,"Action pour la Paix et le Développement Communautaire.ASBL -Eco development, promotion Health & well-being, Humanright,Peace & Governance, nature & Environment.",,,View
1/11/2019,@FAOemergencies,FAO in Emergencies,.@FAO’s #EarlyWarningEarlyAction system had started to pick up dzud warning signs in 🇲🇳 #Mongolia in the autumn of 2017. Watch the video 👉  #InvestInHumanity #ZeroHunger,1083686458433519617,https://www.youtube.com/watch?v=bLIwwswd7mA,,,2,5,TweetDeck,32064,1952,842,✅,6/16/2009,"Rome, Lazio","Official Twitter page for @FAO in emergencies. When we #InvestInHumanity, we can achieve #ZeroHunger. Saving livelihoods saves lives.",http://www.fao.org/emergencies,,View
1/11/2019,@FAOfish,FisheriesAquaculture,#Women play a crucial role in #fisheries and #aquaculture - all along the #valuechains. #BlueGrowth #ZeroHunger,1083680539708665856,,https://pbs.twimg.com/media/DwoBSn6XQAEqDmo.jpg,,35,51,Twitter Web Client,25415,971,700,✅,7/22/2011,"Rome, Italy","UN Food & Agriculture Organization's Fisheries & Aquaculture Department. Follow for updates on the latest meetings, publications, information, and news.",http://www.fao.org/fishery/en,,View
1/11/2019,@EWestaway,Elizabeth Westaway,#Permaculturenow #Bethechange #ActOnClimate #LeaveNoOneBehind #Zerohunger #Localeconomies #SDGs  @WaterAidNigeria @wateraid @WaterAidUK @WaterAidAmerica @WaterAidIndia @WaterAidAus @WaterAidCanada @WaterAidPress @WaterAidNepal @WaterAidBD @wateraidbath @FAO,1083673048199426048,Https://permacultureguidebook.org,,,5,2,Twitter for Android,5077,5580,129,,5/19/2012,,"Public Health Nutrition, Global Development, SDGs, Permaculture, Sustainable Food, Diet-Related NCDs, Food Waste, Soil Health, Climate Change, Social Justice",,,View
1/11/2019,@BalochSami,Sami Baloch,"#Canada! #Balochistan needs your help to fight against #climatechange & #globalwarming which is on peak &amp; #drought is effected for years no action from Pak govt. #WaterCrisis #Thirst #Poverty #Malnutrition #ZeroHunger #OnePlanet #MakeOurLandGreatAgain #MakeOurPlanetGreatAgain RT @gilmour_wendy: A pleasure to discuss such an important issue with Senator @FaisalJavedKhan. Thank you for your time today, and look forward to supporting parliamentary contacts between Canada and Pakistan! @CanHCPakistan @jamesoliphant #CleanGreenPakistan",1083670334082113537,"https://twitter.com/gilmour_wendy/status/1083036396665929728
https://twitter.com/ptiofficial/status/1083008166399565829",,,0,0,Twitter for Android,694,441,202,,5/26/2011,"Saskatoon, Saskatchewan","Human Rights Activist,Freelance Staff/Writer @TheB_Point & VP @WestviewHome.Raising voice 4 justice, equality, respect & dignity.Graduated from U of Balochistan",https://nodbandag.wordpress.com/,,View
1/11/2019,@FAOclimate,FAO Climate Change,Learn more about @FAO's work on #ClimateChange in this latest edition of the booklet:  #ZeroHunger,1083668084534231040,http://ow.ly/smmP30ngXk7,https://pbs.twimg.com/media/Dwn2YUvXgAAb5yn.jpg,,20,24,Hootsuite Inc.,111198,2078,1614,✅,5/21/2010,"Rome, Italy",News and events on food security and climate change from the Food and Agriculture Organization of the United Nations (FAO),http://www.fao.org/climate-change,,View
1/11/2019,@RotiBankIndia,Roti Bank,"""A year ago these children found me distributing food near my house & frm that day they come to me daily when they are hungry. They look at me with full confidence that they won’t return home hungry"" -Komal suri #volunteer @ #rotibank #ZeroHunger #Food #fight #Hunger #feedfeed",1083660893953683456,,pic.twitter.com/KkCLuh2YYt,,16,22,Twitter for Android,114,246,2,,7/30/2018,"New Delhi, India",ताकि कोई भूखा ना रहे ।,,,View
1/11/2019,@MissRaad,Sandra Raad,"A nice article written about the past year of Tech for Food in Iraq, written by a young Iraqi Techpreneur #WFPinnovation #ZeroHunger @WFPInnovation 👉🏼",1083655586850488321,https://medium.com/iraqi-innovators/wfp-tech-for-food-empowers-youth-in-iraq-through-technology-and-microwork-4bf9724f0635,,,0,3,Twitter Web Client,87,131,1,,6/5/2009,,Life is for living. @WFPinnovation,http://innovation.wfp.org,,View
1/11/2019,@BITCIreland,BITC Ireland,The 6 SDGs Companies Should Emphasize During 2019 according to @TriplePundit . @SDGchallenge @SDGBizforum @sdgcounting @SDG2030 @SDGwatcheurope @SDG_Academy @SDGoals @SDGActors @SDGaction @UN_SDG #SDGs #Sustainability #ZeroHunger #genderequity @wef,1083649826510770178,https://buff.ly/2LLPvxH,https://pbs.twimg.com/media/DwnlxkRXQAIawjk.jpg,,1,1,Buffer,5617,2018,192,,8/20/2009,"Dublin City, Ireland",We're the Network for Responsible Business. We are the home for #CSR and #sustainability in #Ireland. Subscribe to our monthly e-zine http://bit.ly/2Dggi4X,http://www.bitc.ie/,,View
1/11/2019,@FAOemergencies,FAO in Emergencies,#PhotooftheDay Beneficiaries receive 🐑 livestock feed provided by @FAO.  #ZeroHunger,1083646696498888704,https://www.flickr.com/photos/faoemergencies/45858969891/in/album-72157703441457114/,https://pbs.twimg.com/media/DuyGZ9tXcAI0TIP.jpg,,0,1,TweetDeck,32064,1952,842,✅,6/16/2009,"Rome, Lazio","Official Twitter page for @FAO in emergencies. When we #InvestInHumanity, we can achieve #ZeroHunger. Saving livelihoods saves lives.",http://www.fao.org/emergencies,,View
1/11/2019,@ALVARO_UNTZ,Alvaro Rodriguez,"1 out of 4 people are malnourished in Sub Saharan Africa! We need to do more! #ZeroHunger #UNTZ RT @UnitedNationsTZ: Nchi za Kusini mwa Jangwa la Sahara zina kiwango kikubwa cha kutapakaa (wastani wa idadi ya watu) kwa njaa. Katika eneo hili kwa kila watu wanne, mtu mmoja hupata lishe duni | #MalengoEndelevu #UNTZ",1083642963220156417,https://twitter.com/UnitedNationsTZ/status/1083604993960226816,https://pbs.twimg.com/media/Dwm8_cZWsAEXSAT.jpg,,2,10,Twitter for Android,15951,1743,89,,4/8/2014,Tanzania,"@UN Resident Coordinator in Tanzania. Interested in #Peace, #Development, #GlobalGoals, #GenderEquality, #Environment. Views are my own.",http://tz.one.un.org,,View
1/11/2019,@EuroFoodBanks,European Food Banks Federation - FEBA,Food collections: a wave of #solidarity to support people in need! Discover how much #food was collected across Europe in 2018 🍴🇪🇺 🚚#volunteering #ZeroHunger #EuroFoodBanks,1083642532674834432,https://www.eurofoodbank.org/en/newsletters/2018-12-13-food-collections:-a-wave-of-european-solidarity-to-support-people-in-need,https://pbs.twimg.com/media/DwnfHzZW0AANiWK.jpg,,1,5,Twitter Web Client,422,354,18,,11/10/2016,"Brussels, Belgium","Est.1986, the European Food Banks Federation (FEBA) represents 388 member Food Banks in 24 countries, who helped 8.1 million people in 2017.",http://www.eurofoodbank.org/,,View
1/11/2019,@AfricaHarvestKe,Africa Harvest,"""To some, it's just dirt. To a farmer, it's potential.@WorldVisionKE @kalromkulima @SOMNIPROJECT @ICRISAT @ICRISATESA @IFAD @selfhelpafrica @aatfafrica @AfDB_Group @AGRAAlliance @kilimoKE @Agri_FinanceKe @FAOKenya @ICRAF @CGIAR #ZeroHunger",1083635824850333696,,https://pbs.twimg.com/media/DwnY8IuXQAAN5Bt.jpg,,4,2,Twitter Web Client,6115,653,70,,2/24/2012,Africa Harvest,"Improving livelihoods of rural communities, and contributing to an Africa free of hunger, poverty and malnutrition.",http://www.africaharvest.org,,View
1/11/2019,@JMukundente,Mukundente J.Bernard,Teaching the younger generation about planting fruits trees is vital for our #ZeroHunger future. Photo credit:@ryaf_agribiz,1083633654994296832,,https://pbs.twimg.com/media/DwnTJXQXQAAmWL3.jpg,,0,1,Twitter Web Client,1486,260,15,,3/4/2013,Kigali/Rwanda,"Communication interns at @RYAF_Agribiz Prod of Documentary films,photography,social Media M&Journ of @RwandaDailynews, Ex J Of #RadioHuguka & #RadioMariaRwanda",https://www.linkedin.com/in/mukundente-jean-bernard-91b685100,,View
1/11/2019,@ELEPHANTVERT,ÉLÉPHANT VERT,5 climate actions we can all take for a #ZeroHunger World,1083633481501065218,http://www.fao.org/fao-stories/article/en/c/1174739/?utm_source=twitter&utm_medium=social+media&utm_campaign=fao,,,0,0,Twitter for Android,1297,1049,57,,4/17/2014,"Serris, France",#agriculture #DD #bio #biofertilisants #biopesticides #microorganismes #biocontrol #microfinance #Afrique #Maroc #Mali #Senegal #CotedIvoire #Kenya #France #UE,http://www.elephant-vert.com/,,View
1/11/2019,@AzeezSalawu,Azeez SALAWU - #SDGs🇳🇬,#2019 General Elections 📦 Vote for Agriculture Vote for Small Scale Farmers Vote For Food Security Vote for ZeroHunger #NigeriaDecides2019 #ZeroHunger #Foodsovereignty #United4Food #MeetTheFarmers #ClimateChange #VoteNotFight,1083633147894554627,,https://pbs.twimg.com/media/DwnWieUXQAAa-sz.jpg,,4,17,Twitter for iPhone,714,1958,11,,7/26/2012,"Abuja, Nigeria",Making impact @cafsng @hedang Food Security||Climate Change||Public Policy||Agribusiness||SDGs Advocate #IITA #FUNAAB #AIESEC #CAFS #YALI,https://www.linkedin.com/in/azeez-a-salawu-18b092104,,View
1/11/2019,@Akaniyene_Henry,Akaninyene Henry,"""Henz Group is geared towards making more positive impacts in the year 2019 in the fight to #ZeroHunger""........CEO",1083631930200023040,https://www.facebook.com/HenzkingdomLtd/videos/238031640466305/,,,0,0,Facebook,14,127,1,,12/19/2012,"Calabar, Nigeria","A Serial Agripreneur, Food Microbiologist, Consultant on Post-Harvest Loss Prevention and Campaigner for #ZeroHunger, #EndPoverty and #RuralDevelopment.",https://www.facebook.com/HenzkingdomLtd/,,View
1/11/2019,@JMukundente,Mukundente J.Bernard,"Wow! keep it up Dimiana, thank you so much @FAO for your greatest support to the young farmers. @grazianodasilva #nextgeneration #Youngfamers #ZeroHunger RT @FAO: “I want to be a farmer."" 11 year old Dimiana's dream began in a school garden after receiving training from a @FAO Junior Farmer Field and Life School. Here is her inspiring story:  #ZeroHunger @FAOAfrica",1083625461740171264,"https://twitter.com/FAO/status/1083411670922338305
http://bit.ly/2UjLfJJ",https://pbs.twimg.com/media/DwkNLDWX4AEqWFn.jpg,,0,0,Twitter Web Client,1486,260,15,,3/4/2013,Kigali/Rwanda,"Communication interns at @RYAF_Agribiz Prod of Documentary films,photography,social Media M&Journ of @RwandaDailynews, Ex J Of #RadioHuguka & #RadioMariaRwanda",https://www.linkedin.com/in/mukundente-jean-bernard-91b685100,,View
1/11/2019,@chanchys1965,Victor M Villalba,7 secrets that forests have been keeping from you The roles of forests in our lives and in our #ZeroHunger future.,1083622943287058432,https://www.latinglobaldevelopment.org/en/7-secrets-that-forests-have-been-keeping-from-you-the-roles-of-forests-in-our-lives-and-in-our-zerohunger-future/,,,0,0,Twitter Web Client,73,631,1,,1/2/2014,Estados Unidos,I live my life in free thoughts. I'm just visiting. CEO and President. LGD,http://www.latinglobaldevelopment.org,,View
1/11/2019,@Responsible_Biz,Responsible Business,#Fish protein wafers to ease acute #malnutrition in children via @SciDevNet #sdgs #sdgaction #zerohunger,1083619550065844224,https://bit.ly/2VGIJxS,https://pbs.twimg.com/media/DwnKPPnX4AAzIZE.jpg,,1,0,Hootsuite Inc.,4304,1417,210,,7/1/2013,Singapore,"The Responsible Business Forum (RBF) on Food & Agriculture will be held in Thailand, 26 - 27 March 2019",http://www.ResponsibleBusiness.com,,View
1/11/2019,@mayumi_dubai,Mayumi_Dalisay,Hey guys! Want to have a good start this year? I am encouraging you to support this program and fight to end hunger! Become a ZeroHunger Hero today. Save lives with @WFP by giving hungry children nutritious food:   #ZeroHunger,1083612843923177473,"http://wfp.org/monthly
http://wfp.org/monthly/",,,0,0,Twitter for iPhone,1046,94,0,,6/5/2018,"Dubai, United Arab Emirates",MAYUMI - ang tawag sa dirty at yucky cherete! 😝,,,View
1/11/2019,@captainekun,Ekun Eko,"#SDG2 #ZeroHunger RT @kingfuhad1: Twitter fam. I really need your help. I need your retweet’s and likes, please let’s make this happen",1083610830938230785,https://twitter.com/kingfuhad1/status/1083018335728611328,https://pbs.twimg.com/media/DwenIfLWoAUErsG.jpg,,1,2,Twitter for Android,64,118,1,,7/9/2010,"Lagos, Nigeria",Civil Engineer | Environmentalist | Language freak | Nature lover,http://facebook.com/adonismipe,,View
