Date,Screen Name,Full Name,Tweet Text,Tweet ID,Link(s),Media,Location,Retweets,Favorites,App,Followers,Follows,Listed,Verfied,User Since,Location,Bio,Website,Timezone,Profile Image
1/19/2019,@AktionDemograph,Echter Klimaschutz kann nur von der Basis aus wach,#Merkel hofft auf #Digitalisierung zur Lösung von landwirtschaftlichen Konflikten  via @topagrar #Klimawandel #Digitalisierung #SDGs #Umwelt #Natur #Welternährungskonferenz #Hunger #ZeroHunger #Ernäherungssicherheit #GFFA #IGW2019 #Landwirtschaft #Landwirt,1086556829885304832,https://www.topagrar.com/management-und-politik/news/merkel-hofft-auf-digitalisierung-zu-loesung-von-landwirtschaftlichen-konflikten-10208242.html,,,0,0,Twitter Web Client,1513,5001,276,,12/31/2010,"Berlin, Deutschland",#RiseforClimate Echter #Klimaschutz kann nur von der Basis aus wachsen,https://de.riseforclimate.org/,,View
1/19/2019,@FAOnews,FAO Newsroom,"In Africa, investing in rural development and agriculture will offer rural youth an alternative to #migration FAO DG @grazianodasilva highlights the importance of focusing on the troubled areas of the Sahel at the #GFFA 👉  #ZeroHunger",1086553524387958784,https://bit.ly/2Dl0v2F,https://pbs.twimg.com/media/DxQ2qq4WwAE785C.jpg,,4,3,Twitter for Android,2920,1055,36,,5/10/2018,http://www.fao.org/news,"Latest news from the media relations team of @FAO, the UN agency that leads international efforts to defeat hunger. #ZeroHunger",http://www.fao.org/news,,View
1/19/2019,@ONUPortugal,ONU Portugal,Veja como pode ajudar o programa do @WFP #FeedOurFuture a alcançar um mundo sem fome  #ZeroHunger,1086552846361874432,http://wfp.org/donate-now,,,0,0,TweetDeck,1260,907,14,,1/29/2014,Bruxelas,Conta oficial da ONU para Portugal 🇺🇳 Centro Regional de Informação das Nações Unidas para a Europa Ocidental.👉Informar e envolver os Europeus. 🌍,https://www.unric.org/pt/,,View
1/19/2019,@Welthungerhilfe,Welthungerhilfe,Besuch uns auf der #GrueneWoche in Berlin. Dort stellen wir dir unser digitalen Innovationen vor. Wir freuen uns auf dich! 😀 #ZeroHunger #AgriShare @ChildGrowthMon,1086546306028449792,https://www.welthungerhilfe.de/aktuelles/veranstaltungen/2019/welthungerhilfe-auf-der-gruenen-woche-2019/,,,0,0,Falcon Social Media Management ,151619,1741,571,✅,6/24/2009,"Bonn, Germany",Aid organisation - for a world without #hunger and #poverty. From emergency relief to long-term projects with local partners. #ZeroHunger by 2030.,http://www.welthungerhilfe.de,,View
1/19/2019,@CazeauHue,Pierrette  J.Cazeau,We need to increase the availability of and access to nutritious foods. But conventional staple foods do not supply all the nutrients needed for a balanced diet. We need to explore new types of plants to ensure our #FutureofFood. #ZeroHunger RT @FAO: We need to increase the availability of and access to nutritious foods. But conventional staple foods do not supply all the nutrients needed for a balanced diet. We need to explore new types of plants to ensure our #FutureofFood. #ZeroHunger,1086542230884704256,https://twitter.com/FAO/status/1086395351555293185,https://pbs.twimg.com/media/DxOm0HpWsAAd8aX.jpg,,0,0,Twitter Web Client,1439,2081,27,,10/21/2011,"Lake Worth, FL","Abstract Reviewer APHA-SA, GHS,HIV/AIDS, Manuscript Reviewer IJCRIMPH, Proposal Reviewer AGS, Train W/CDC,CMS SMDSGlobal Delegate/Observer @UNEP #SDG",http://www.hcrff.org,,View
1/19/2019,@RotiBankIndia,Roti Bank,The weekend has come with a beautiful thankyou message from the children of MCD school in TilakNagar #Delhi. Every week #RotiBank provides fruits to these children to boost their vitality #weekend #Feed #foodfood #ZeroHunger #nutrition #health #schools #Children #fight #hunger,1086541269097156610,,pic.twitter.com/924cULapOg,,1,1,Twitter for Android,114,246,2,,7/30/2018,"New Delhi, India",ताकि कोई भूखा ना रहे ।,,,View
1/19/2019,@FAO,FAO,Family farmers 👩‍🌾👨‍🌾 produce 80% of the world's food! They are born innovators and without them we wouldn't be able to achieve #ZeroHunger! We need to invest in family farmers and innovation 👉  #AgInnovation #GFFA,1086531960179224576,"http://bit.ly/2FzVWUf
http://bit.ly/2sz8oeq",,,11,21,Buffer,272102,529,4999,✅,1/28/2009,"Rome, Italy","Working for #ZeroHunger, a sustainable 🌍 and a secure #FutureofFood for all. Our actions are our future.",http://fao.org,,View
1/19/2019,@hmrff,HMRFF,"The last ten years have witnessed two different ideological pursuits at the center, but the circumstances pertaining to feeding the underprivileged have been the same yet. #10yearChallenge #Hunger #poverty #food #Children #zerohunger #EndHunger #hungerrelief",1086526149356773376,,https://pbs.twimg.com/media/DxQdw1iU0AEx490.jpg,,1,1,Twitter for Android,28,94,0,,8/16/2018,New Delhi,Hunger and Malnutrition Relief Fund Foundation (HMRFF) is a non-profit & charitable organization. #endhunger,http://www.hmrff.org,,View
1/19/2019,@i_mnilesh,Nilesh Mishra,Digital Technolgies and #FutureofFood #Zerohunger @ihubICRISAT @iHub @ICRISAT @SNag_ @skanikasingh RT @FAO: How using digital services and technologies in agriculture is one step closer to securing our #FutureofFood 👇 #ZeroHunger #GFFA #AgInnovation,1086500877421076480,https://twitter.com/fao/status/1086227462705549312,pic.twitter.com/Py39cF778Z,,0,0,Twitter for iPhone,528,594,97,,2/11/2010,"Deoria (UP), Hyderabad, India",ICT4D practitioner @ICRISAT| Interest: #DigitalAgriculture #SciComm #SocialMedia4agri #Music. RTs≠ Endorsement. Alma Mater #NAARM @ICARINDIA,http://www.icrisat.org,,View
1/19/2019,@annamritapune,annamritapune,Annamrita:feeding india's future Link in bio Follow us on: Facebook:annamrita pune Instagram : annamritapune Website:  #annamritapune #zerohunger #children #smile #joy #joyofgiving #pune,1086490395775721478,http://www.annamritapune.org,https://pbs.twimg.com/media/DxP9P4xU0AAnTXU.jpg,,1,0,Twitter for iPad,6,10,0,,10/19/2018,"Annamrita Foundation,Opposite Vastu Udyog Colony, Masulkar Colony, Pimpri, haveli
Pune, Maharashtra","Annamrita is a not-for-profit NGO founded in 2004, our purpose is to provide mid-day meals to schools across India to underprivileged children's.🙂",http://www.annamritapune.org/,,View
1/18/2019,@IDIforImpact,India Data Insights,"The numbers on undernourishment (and related complications such as anaemia) in India are staggering. We have some data here:  #SDG2 #ZeroHunger #Nutrition #Health RT @dasra: It's astonishing that 45% of India's children are stunted and 600,000 children under five die each year, largely because of inadequate water supply and poor #sanitation #health #SDG6",1086488320475947009,"https://www.indiadatainsights.com/reports/nutrition-indicators-nfhs-4-all-india-2015-16-2/
https://twitter.com/dasra/status/1086286106499239941",,,0,2,Twitter Web Client,20,53,0,,11/8/2018,,,http://indiadatainsights.com,,View
1/18/2019,@FAO,FAO,Raising #livestock is the most important livelihood in #Mongolia – and is the sole source of income for 35% of households. 🐐🐑 Learn how early action helped save Mongolian herders' livelihoods 👉  #ZeroHunger,1086463007927033856,http://bit.ly/2QxuN5G,https://pbs.twimg.com/media/DxPkWRZWkAEDaBs.jpg,,5,18,Buffer,272102,529,4999,✅,1/28/2009,"Rome, Italy","Working for #ZeroHunger, a sustainable 🌍 and a secure #FutureofFood for all. Our actions are our future.",http://fao.org,,View
1/18/2019,@allequality2017,allequality2017,"Hon’ble ALL,#EQUALITY ENABLES TO FOLLOW #PEACE.#GDPS;#JOBS MAY GROW(10-400%)BY SCIENTIFICALLY FARMING ½YEARLY LEFTOVER CULTIVABLE EMPTY LANDS(15-50%)IN THE GLOBE #DEMOCRATICALLY.THIS MAY MEET #JOBS;#ZeroHunger FOR ALL👫.Inconvenience caused is deeply regretted.#TimeToSecureALL&🌎",1086457220005388288,,https://pbs.twimg.com/media/DxPfBEoUUAAqLyx.jpg,,0,0,Twitter for Android,105,4992,0,,2/4/2017,#PEACE#LOVE#HUMANITY#EQUALITY,"Hon’ble All,EQUALITY ENABLES TO FOLLOW PEACE,LOVE,UNITY, COMPASSION,HUMANITY & SOUL. Inconvenience caused is deeply regretted.BRgds📧allequality2019@yahoo.com",,,View
1/18/2019,@allequality2017,allequality2017,"Hon’ble ALL,#EQUALITY ENABLES TO FOLLOW #PEACE.#GDPS;#JOBS MAY GROW(10-400%)BY SCIENTIFICALLY FARMING ½YEARLY LEFTOVER CULTIVABLE EMPTY LANDS(15-50%)IN THE GLOBE #DEMOCRATICALLY.THIS MAY MEET #JOBS;#ZeroHunger FOR ALL👫.Inconvenience caused is deeply regretted.#TimeToSecureALL&🌎",1086445304369442816,,https://pbs.twimg.com/media/DxPUIsrUUAAheEO.jpg,,0,0,Twitter for Android,105,4992,0,,2/4/2017,#PEACE#LOVE#HUMANITY#EQUALITY,"Hon’ble All,EQUALITY ENABLES TO FOLLOW PEACE,LOVE,UNITY, COMPASSION,HUMANITY & SOUL. Inconvenience caused is deeply regretted.BRgds📧allequality2019@yahoo.com",,,View
1/18/2019,@AgPeriUrban,Lisa Brassington 💚,"Visiting @fareshare_aus in Melbourne yesterday, were Cathy and Les from their Congupna dairy farm #HowNowDairy 🐮🐄🍶 delivering 400L. Read their story online 📸  or 💻  🐮🍶 #DairyLove #agchatoz #ZeroWaste #ZeroHunger #FightHunger",1086420396734218240,"https://www.instagram.com/hownowmilk
http://www.hownowdairy.com.au/",https://pbs.twimg.com/media/DxO9kWIVAAA4TxG.jpg,,1,0,Twitter for Android,790,952,19,,10/28/2011,OnTheEdgeSEMelbourne,Soil/Water/Seed/Produce/Customer/Table. Connect Agriculture in PeriUrban Australia. #Horticulture #2017WomeninHort #RWA2017 #UTAS_alumni https://bit.ly/2TGmhnA,,,View
1/18/2019,@FAO,FAO,We need to increase the availability of and access to nutritious foods. But conventional staple foods do not supply all the nutrients needed for a balanced diet. We need to explore new types of plants to ensure our #FutureofFood. #ZeroHunger,1086395351555293185,,https://pbs.twimg.com/media/DxOm0HpWsAAd8aX.jpg,,18,48,Buffer,272102,529,4999,✅,1/28/2009,"Rome, Italy","Working for #ZeroHunger, a sustainable 🌍 and a secure #FutureofFood for all. Our actions are our future.",http://fao.org,,View
1/18/2019,@3BLMedia,3BL Media,"How @DSM is aligning its expertise in #health, #nutrition and #materials with the #SDGs:  #zerohunger @GreenBiz",1086393063612702720,https://bit.ly/2QNBkt7,https://pbs.twimg.com/media/DxOku-DVsAAL8gT.jpg,,0,0,dlvr.it,22600,9716,2315,,3/9/2009,Global,The leading content marketing and distribution platform for themes including #CSR #Sustainability #SocEnt #SocInn #Health #Energy #Education and MORE!,http://www.3blforum.com/brands-taking-stands-newsletter,,View
1/18/2019,@allequality2017,allequality2017,"Hon’ble ALL,#EQUALITY ENABLES TO FOLLOW #PEACE.#GDPS;#JOBS MAY GROW(10-400%)BY SCIENTIFICALLY FARMING ½YEARLY LEFTOVER CULTIVABLE EMPTY LANDS(15-50%)IN THE GLOBE #DEMOCRATICALLY.THIS MAY MEET #JOBS;#ZeroHunger FOR ALL👫.Inconvenience caused is deeply regretted.#TimeToSecureALL&🌎",1086391737939980289,,https://pbs.twimg.com/media/DxOjaqKVsAA1CII.jpg,,0,0,Twitter for Android,105,4992,0,,2/4/2017,#PEACE#LOVE#HUMANITY#EQUALITY,"Hon’ble All,EQUALITY ENABLES TO FOLLOW PEACE,LOVE,UNITY, COMPASSION,HUMANITY & SOUL. Inconvenience caused is deeply regretted.BRgds📧allequality2019@yahoo.com",,,View
1/18/2019,@ImedKhanfir,imed khanfir,"Now we know that @WFP_SouthSudan and @WFP_P4P are supporting #smallholders to achieve #ZeroHunger RT @WFP_SouthSudan: #DidYouKnow: In 2018, @WFP procured over 430 mt of food from local smallholder farmers in #SouthSudan for use in some of its activities? Well, now you do!",1086389891578122242,https://twitter.com/wfp_southsudan/status/1085961851651919874,https://pbs.twimg.com/media/DxIb_UnXgAA6w_K.jpg,,0,0,Twitter for iPad,47,84,10,,5/24/2011,"Rome, Lazio",Programme Officer at @WFP connecting farmers to markets. Views my own.,,,View
1/18/2019,@sic4change,Sic4change,"🌈☀️Sesión d trabajo para combatir #desnutrición en #UnMundoSinFronteras gracias a #TecnologíaAlServicioDeLasPersonas Tenemos un #plan, #proyectos, #InteligenciaCompartida, #alianzas... ¡y nos encantan los #retos! #EstePartidoLoVamosAGanar 💪 #ZeroHunger  RT @Aecid_Guatemala: #Alianzas| @sic4change apuesta por la búsqueda de soluciones innovadoras contra la desnutrición crónica en #Guatemala. @Borja_Monreal y @EistrupMathias estuvieron con nosotros hablando sobre #Nut4Health y #Emilpa. Más info 👉🏾",1086385750105567233,"https://www.sic4change.org/iniciativas
https://twitter.com/Aecid_Guatemala/status/1086344238965710849
https://goo.gl/aC51oF",https://pbs.twimg.com/media/DxN30kFUUAA4yHq.jpg,,1,2,Twitter Web Client,269,711,5,,5/22/2017,"Madrid, Comunidad de Madrid",Creamos y dinamizamos procesos de #InnovaciónSocial basados en diagnósticos y escucha. Creamos #startups sociales para resolver problemas. #socinn #Tech,http://www.sic4change.org,,View
1/18/2019,@FAOWHOCodex,Codex Alimentarius,📋 | @FAO | Achieving #ZeroHunger: The Critical Role of Investments in Social Protection and Agriculture   #SDGs #MustRead,1086380228379856896,"http://ow.ly/cqBH30nms9u
http://ow.ly/rkI930nmse4",https://pbs.twimg.com/media/DxOZDzFXcAUcSRR.jpg,,1,2,Hootsuite Inc.,8612,1495,186,✅,11/23/2014,"Roma, Lazio",The official account of the FAO WHO Codex Alimentarius tweeting on International Standard setting and food safety issues.,http://www.codexalimentarius.org,,View
1/18/2019,@EWestaway,Elizabeth Westaway,#Permaculturenow #Bethechange #ActOnClimate #LeaveNoOneBehind #Zerohunger #Localeconomies #SDGs  @adraoesterreich @adraphilippines @adrasomalia @ADRATimorLeste @adrauk @AdraUruguay @adra_venezuela @adravc @ADRAZimbabwe @Concern @ConcernKenya @concernactive,1086364532203810817,Https://permacultureguidebook.org,,,1,1,Twitter for Android,5077,5580,129,,5/19/2012,,"Public Health Nutrition, Global Development, SDGs, Permaculture, Sustainable Food, Diet-Related NCDs, Food Waste, Soil Health, Climate Change, Social Justice",,,View
1/18/2019,@AktionDemograph,Echter Klimaschutz kann nur von der Basis aus wach,Deutsche #Bundeskanzlerin #Merkel beim #Welternährungsforum #GFFA in Berlin: #Digitalisierung bietet weltweit #Chancen“  @bmel #IGW2019 #Agrarpolitik #Landwirtschaft #JuliaKlöckner #Klimawandel #Hunger #Zerohunger #Ernäherungssicherheit #SDGs #foodsafety,1086350486708670465,https://www.bmel.de/DE/Landwirtschaft/Welternaehrung/_Texte/gffa-2019-digitalisierung-landwirtschaft.html,https://pbs.twimg.com/media/DxN9qYbX0AINuwA.jpg,,2,3,Twitter Web Client,1513,5001,276,,12/31/2010,"Berlin, Deutschland",#RiseforClimate Echter #Klimaschutz kann nur von der Basis aus wachsen,https://de.riseforclimate.org/,,View
1/18/2019,@AmericaQuesada,América Quesada,"#HambreCero #ZeroHunger RT @FAOenEspanol: Las #abejas y otros #polinizadores son clave para la producción de nuestros alimentos, para la conservación de la #biodiversidad... y mucho más. 🐝 🌺🦇🌻🐦🌷🐭 #HambreCero",1086336482082803719,https://twitter.com/FAOenEspanol/status/1085979075301249025,https://pbs.twimg.com/media/DxIsNo9X0AAnhqQ.jpg,,0,0,Twitter for Android,0,67,0,,1/18/2019,"Community of Madrid, Spain",La calidad y la seguridad alimentaria son mi pasión. Veinte años gestionandp grandes poyectos y lo que queda por aprender.,https://americaquesada.com,,👤
1/18/2019,@V_D_001,Varun Suri,#Friyay #thehungergames #colors #buzzfeedfood #zerohunger #restaurant #fighthunger #colors #hunger #colorsplash #fastfood #fast #restaurantreview #yellow #red #orange #stimulate,1086329897591554049,,https://pbs.twimg.com/media/DxNrSMMV4AA7Lv5.jpg,,0,0,Crowdfire Inc.,143,267,0,,8/9/2011,"CHANDIGARH, INDIA",We Live young☺.♥ We live free.♥,,,View
1/18/2019,@caprazli,Kafkas Caprazli,".""Fue un gran placer! "".🧐 #agchat #ZeroHunger Att. FAO FAOafrica FAOEastAfricaRT @lmetchevehere: Con @grazianodasilva en #Berlín coincidimos en que a través de la digitalización de la agricultura, mejorando la conectividad, nos encaminamos hacia una producción sostenible y una alimentación nutritiva en el mundo.",1086328994226569216,https://twitter.com/lmetchevehere/status/1086280719029231616,https://pbs.twimg.com/media/DxM-jGAUUAEJjRU.jpg,,0,0,IFTTT,1069,2816,481,,1/16/2009,"Addis Ababa, Ethiopia","Working at FAO of the UN - for a world free of hunger: #DRR #SDGs. Tweets are personal. I'm trying to think, don't confuse me with facts.",http://www.fao.org/,,View
1/18/2019,@ElenaSgarbossa,Elena Sgarbossa MD Ⓥ,Making Healthy School Lunches Free for All Should Be a National Priority #ZeroHunger #school #nutrition #EatClean #WFPB #pediatrics #hunger #malnutrition #education,1086326416445267968,https://civileats.com/2018/12/14/making-healthy-school-lunches-free-for-all-should-be-a-national-priority/,,,0,0,Twitter for iPad,1069,235,157,,2/21/2016,"Weston, Florida  USA",Med writer/editor. Ethics. Cardiology. NCDs. Social justice. Yoga. Mindfulness. Clean eating. #vegan #EffectiveAltruism #AR #ItsTheDiet #green #lifestyle med🌱,https://www.linkedin.com/in/elenasgarbossa,,View
1/18/2019,@ciaorinoclub,CiaoRino!🎩  Club,Actionaid Realizza il Cambiamento - #zerohunger 16 ottobre 2018,1086318067293016064,https://www.youtube.com/watch?v=3KEHgCHfzhQ,,,0,0,Facebook,562,1877,1,,6/2/2010,"Perugia, Umbria",14/12 #secretconcerts in #Tributo a #LucioBattisti START ORE 23,http://www.ciaorinoclub.it,,View
1/18/2019,@Cargill,Cargill,"Solving the global challenges of food security, #zerohunger, inclusive #trade and competitiveness is crucial to creating a sustainable and resilient agriculture sector. #GFFA",1086313811190124544,,https://pbs.twimg.com/media/DxNcp04XcAA_2f6.jpg,,5,18,Spredfast app,47863,262,916,✅,4/28/2009,"Minneapolis, Minnesota (HQ)",Official Twitter account for Cargill Inc.,http://www.cargill.com,,View
1/18/2019,@cropprotection,ECPA,#Pesticides increase crop production by maximising productivity on existing agricultural lands thus helping meet #SDG2 #zerohunger #foodsecurity #WithOrWithout,1086313780039032832,,pic.twitter.com/kiMQPyK23R,,2,3,Sprout Social,9699,5009,345,,2/16/2009,Europe,Securing food supply with crop protection solutions - #WithOrWithout #pesticides? - #ag #food #health #water #biodiversity,http://www.ecpa.eu,,View
1/18/2019,@GCNLebanon,Global Compact Lebanon,We need to end hunger in all its forms by 2030 ! Let's unite our efforts to make sure we have enough good -quality food for everyone! #FactFriday #SDG2 #ZeroHunger,1086312201164652544,,pic.twitter.com/5BwqimnUzd,,0,1,Twitter for Android,552,331,12,,8/12/2015,"Beirut, Lebanon",Global Compact Network Lebanon is the official network for all United Nations Global Compact participants in Lebanon.,http://globalcompact-lebanon.org,,View
1/18/2019,@FAOWHOCodex,Codex Alimentarius,"📝 | On September 25th 2015, countries adopted a set of goals to #endpoverty, protect the planet and ensure prosperity for all. Learn how #Codex is working to achieve these goals ➡  #ZeroHunger #HealthForAll #SDGs @FAOSDGs @GlobalGoalsUN",1086311031016697856,http://ow.ly/jQ0k30nmold,https://pbs.twimg.com/media/DxNaICpXcAIXGaU.jpg,,2,3,Hootsuite Inc.,8612,1495,186,✅,11/23/2014,"Roma, Lazio",The official account of the FAO WHO Codex Alimentarius tweeting on International Standard setting and food safety issues.,http://www.codexalimentarius.org,,View
1/18/2019,@That_A_Lady,Amanda.,Check out these opportunities  and  #Youth4Ag #YouthInAg #ZeroHunger #ClimateAction,1086310665265049602,"https://www.global-solutions.international/scholarship
https://allianceforscience.cornell.edu/wp-content/uploads/2019/01/2019-APPLICATION-Alliance-for-Science-Global-Leadership-Fellows-Program.pdf",,,0,0,Twitter Web Client,1656,1584,13,,3/7/2011,Nairobi,Daughter of the Most High God || #SpreadTheGospel via @christfragrance || Youth Advocate for #ClimateAction & #ZeroHunger || Youth In Agriculture initiatives,https://myfragranceofchrist.com/2019/01/18/the-game-and-not-the-gear/,,View
1/18/2019,@caprazli,Kafkas Caprazli,".""In #Africa, we need to invest in rural #development aimed at creating #jobs and opportunities for young people to remain in rural areas. We need youth for modern #agriculture. #GFFA "".🧐 #agchat #ZeroHunger Att. FAO FAOafrica FAOEastAfrica",1086306372432609280,,https://pbs.twimg.com/media/DxNVBLlXgAAM1D5.jpg,,1,2,IFTTT,1069,2816,481,,1/16/2009,"Addis Ababa, Ethiopia","Working at FAO of the UN - for a world free of hunger: #DRR #SDGs. Tweets are personal. I'm trying to think, don't confuse me with facts.",http://www.fao.org/,,View
1/18/2019,@humanitasglobal,Humanitas Global,#Cambodia has partnered with the @WFP in order to reduce hunger nation-wide. It is global partnerships such as these that will help the world achieve our #ZeroHunger goal by 2030!,1086305214540333061,https://bit.ly/2FbjG0Q,,,0,0,TweetDeck,1469,926,106,,5/13/2009,"Washington, DC","Delivering development impact at scale through multisectoral collaborations, community engagement and better policies and programs.",http://www.humanitasglobal.com,,View
1/18/2019,@DariusAryaDigs,Darius Arya,Amazing views from my @FAO visit today! Learned a lot about this important organization and current initiatives #ZeroHunger,1086305140578152448,,https://pbs.twimg.com/media/DxNUwkOX0AEPNHy.jpg,,0,18,Twitter for iPhone,18086,1830,711,✅,3/2/2009,"Rome, usually",History. Archaeology. Travel. TV host 4 Under Italy @raicinque (in italiano) podcast Travel: In Situ https://apple.co/2AiJ4he Collaborate: hi@dariusaryadigs.com,http://www.dariusarya.co,,View
1/18/2019,@AttshanAliAbbas,Attshan Ali Abbasi,#Innovation is key as it #provides a new #perspective. 🎥 Here #drones are #helping #determine the damage to crops after natural #disasters so farmers can get help #faster 👇 Introduce this #Technology in Pakistan. @ImranKhanPTI @ArifAlvi @Asad_Umar #AgInnovation #ZeroHunger,1086304067192791043,,pic.twitter.com/Ji5PKfkokM,,1,10,Twitter for Android,3774,4363,5,,4/13/2014,Islamabad +92332-5500083 https,"M Phil (Policy Analyst) World Record Holder Ambassador Census Leader, NYA Writer Parliament of Pak Book. Artist. Inter Observer, Director, Producer, Mazdoor.",http://www.dailytimes.com.pk/70792/24-year-old-pakistani-makes-world-record/amp,,View
1/18/2019,@FAOemergencies,FAO in Emergencies,Healthy 🐓🐄🐑 animals = elimination of #hunger = healthy people = sustainable food production 👉  #ZeroHunger,1086294393131155456,http://www.fao.org/emergencies/results/en/?keywords=ANIMAL%20HEALTH,https://pbs.twimg.com/media/DxCzJgVX0AI0RzP.jpg,,4,5,TweetDeck,32064,1952,842,✅,6/16/2009,"Rome, Lazio","Official Twitter page for @FAO in emergencies. When we #InvestInHumanity, we can achieve #ZeroHunger. Saving livelihoods saves lives.",http://www.fao.org/emergencies,,View
1/18/2019,@FAOeagriculture,FAO e-Agriculture,"At #GFFA2019 ""Utilizing the Power of Digital Innovations for Youth, smallholders and family farmers"" 👉  #AgInnovation #ZeroHunger #ICT4Ag",1086289083008192513,https://bit.ly/2DeKmvz,https://pbs.twimg.com/media/DxNFzGcX0AA2Pk0.jpg,,2,5,Twitter Web Client,47936,1231,934,,1/8/2009,global,A global initiative to enhance sustainable agricultural development & food security by improving the use of information and communication technologies. Join us!,http://www.fao.org/e-agriculture/,,View
1/18/2019,@FAO,FAO,Innovation is key as it provides a new perspective. 🎥 Here drones are helping determine the damage to crops after natural disasters so farmers can get help faster 👇 #AgInnovation #ZeroHunger #GFFA,1086284201069068288,,pic.twitter.com/w7tBPT3aQM,,105,193,Buffer,272102,529,4999,✅,1/28/2009,"Rome, Italy","Working for #ZeroHunger, a sustainable 🌍 and a secure #FutureofFood for all. Our actions are our future.",http://fao.org,,View
1/18/2019,@caprazli,Kafkas Caprazli,".""Family photo with Chancellor AngelaMerkeICDU at #GFFA. #ZeroHunger #GFFA2019 "".🧐 #agchat #ZeroHunger Att. FAO FAOafrica FAOEastAfrica",1086281184731123712,,https://pbs.twimg.com/media/DxM-HbYUcAA6ryj.jpg,,0,0,IFTTT,1069,2816,481,,1/16/2009,"Addis Ababa, Ethiopia","Working at FAO of the UN - for a world free of hunger: #DRR #SDGs. Tweets are personal. I'm trying to think, don't confuse me with facts.",http://www.fao.org/,,View
1/18/2019,@grazianodasilva,José Graziano da Silva,Family photo with Chancellor @AngelaMerkeICDU at #GFFA. #ZeroHunger #GFFA2019,1086281006594904065,,https://pbs.twimg.com/media/DxM-HbYUcAA6ryj.jpg,,0,11,Twitter Web Client,23971,1344,572,✅,11/2/2010,"Rome, Italy",@FAO Director-General. Committed to working in partnership to reach a #ZeroHunger and sustainable world.,http://www.fao.org/about/director-gen/en/,,View
1/18/2019,@caprazli,Kafkas Caprazli,".""At #GFFA, I met up with minister APivec and we discussed the importance of honeybees for sustainable #food production and the preservation of eco-systems. #ZeroHunger "".🧐 #agchat #ZeroHunger Att. FAO FAOafrica FAOEastAfrica",1086278844984619009,,https://pbs.twimg.com/media/DxM8jMuVAAMj6mP.jpg,,0,0,IFTTT,1069,2816,481,,1/16/2009,"Addis Ababa, Ethiopia","Working at FAO of the UN - for a world free of hunger: #DRR #SDGs. Tweets are personal. I'm trying to think, don't confuse me with facts.",http://www.fao.org/,,View
1/18/2019,@grazianodasilva,José Graziano da Silva,"At #GFFA, I met up with minister @APivec and we discussed the importance of honeybees for sustainable #food production and the preservation of eco-systems. #ZeroHunger",1086278522522353664,,https://pbs.twimg.com/media/DxM8jMuVAAMj6mP.jpg,,4,9,Twitter Web Client,23971,1344,572,✅,11/2/2010,"Rome, Italy",@FAO Director-General. Committed to working in partnership to reach a #ZeroHunger and sustainable world.,http://www.fao.org/about/director-gen/en/,,View
